{
  "ranked": [
    {
      "rank": 1,
      "item_label": "Orbit Ledger (orbit.example)",
      "status": "ok",
      "verdict": "Major",
      "score": 13,
      "score_scale": "0-45",
      "headline": "Added a usage-based plan and launched an approvals module for finance teams.",
      "source_ids": [
        "S1",
        "S2",
        "S3"
      ]
    }
  ],
  "shown": 1,
  "skipped_count": 0,
  "failed": [],
  "report": {
    "title": "Competitor changes",
    "summary": "Major: Orbit Ledger added a usage-based plan and launched an approvals module for finance teams.",
    "severity": "info",
    "sections": [
      {
        "heading": "Orbit Ledger (orbit.example) — Major",
        "body_md": "Major: Orbit Ledger added a usage-based plan and launched an approvals module aimed at finance teams.",
        "items": [
          {
            "text": "2026-10-12 (observed): pricing page adds a usage-based Growth plan from $400/month. So what: undercuts our entry price for small teams.",
            "citations": [
              "S1"
            ],
            "label": "pricing"
          },
          {
            "text": "2026-10-09: launched an approvals module for finance teams. So what: overlaps our approval flows; check feature depth.",
            "citations": [
              "S2"
            ],
            "label": "launch"
          },
          {
            "text": "2026-10-07: hired a VP Partnerships from a payments company. So what: watch for new channel partners.",
            "citations": [
              "S3"
            ],
            "label": "leadership"
          }
        ]
      }
    ],
    "sources": [
      {
        "id": "S1",
        "url": "https://orbit.example/pricing",
        "title": "Orbit Ledger pricing",
        "provider": "tavily"
      },
      {
        "id": "S2",
        "url": "https://news.example.com/orbit-approvals",
        "title": "Orbit Ledger launches approvals",
        "published_at": "2026-10-09",
        "provider": "tavily"
      },
      {
        "id": "S3",
        "url": "https://news.example.com/orbit-vp-partnerships",
        "title": "Orbit Ledger names VP Partnerships",
        "published_at": "2026-10-07",
        "provider": "tavily"
      }
    ],
    "unknowns": [],
    "meta": {
      "skill": "results-rank",
      "skill_version": "1.3.1",
      "generated_at": "2026-10-12T09:00:00Z"
    }
  }
}
